anchor,homophones,synonyms,phon_dist,graph_dist
ˈb e ɪ t,ˈb e ɪ t,ˈt ɔ ɹ m ə n t,ˈb e ɪ b,ˈa ɪ t
ˈb ɔ ɫ d,ˈb ɔ ɫ d,ˈh ɛ ɹ ɫ ə s,ˈb ɔ ɫ ɝ,ˈb æ d
ˈb ɔ ɫ,ˈb ɔ ɫ,ˈh ɑ ɫ ɝ,ˈb ɑ ɫ,ˈb ɔ
ˈb æ n d,ˈb æ n d,ˈɛ n s ə m b ə ɫ,ˈb æ ɡ d,ˈæ n d
ˈb ɛ ɹ,ˈb ɪ ɹ,ˈn u d,ˈb ɑ ɹ,ˈb e ɪ d
ˈk æ ʃ,ˈk e ɪ t ʃ,ˈm o ʊ n i,ˈb æ ʃ,ˈk æ s t
ˈk æ n t ɝ,ˈk æ n t ɝ,ˈt ʃ æ n t ɝ,ˈb æ n t ɝ,ˈk æ n t ɝ z
ˈk ɛ ɫ,ˈs ɛ ɫ,ˈk e ɪ d ʒ,ˈb ɛ ɫ,ˈb ɛ ɫ
ˈk j u,ˈk w u,ˈh ɪ n t,ˈk ɫ u,ˈd u
ˈɝ n,ˈɝ n,ˈɑ ˈk w a ɪ ɝ,ˈa n,ˈɑ ɹ n
ˈn u,ˈn u,ˈɹ i s ə n t,ˈb u,ˈe ɪ ˈn u
ˈn o ʊ,ˈn o ʊ,ˈɫ ɝ n,ˈb o ʊ,ˈɛ n o ʊ
ˈm e ɪ n,ˈm i n,ˈs ɛ n t ɹ ə ɫ,ˈb e ɪ n,ˈa m e ɪ n
ˈm i t,ˈm i t,ɛ n ˈk a ʊ n t ɝ,ˈb i t,ˈb i t
ˈm ɛ d ə ɫ,ˈm ɛ d ə ɫ,ˈɹ u ɝ d,ˈb ɛ d ə ɫ,ˈm i ɫ
ˈm a ɪ n d,ˈm a ɪ n d,ˈp i ˈs a ɪ k,ˈb a ɪ n d,ˈf ɪ n d
ˈm ɪ n ɝ,ˈm a ɪ n ɝ,ˈs ɛ k ə n ˌd ɛ ɹ i,ˈd ɪ n ɝ,ˈm e ɪ n ɝ
ˈm ə s ə ɫ,ˈm ə s ə ɫ,ˈt ɪ ʃ u,ˈb ə s ə ɫ,ˈm ə s ə ɫ d
ˈn e ɪ v ə ɫ,ˈn æ v ə ɫ,m ɝ ˈi n,ˈk e ɪ v ə ɫ,ˈe ɪ v ə ɫ
ˈp e ɪ n,ˈp e ɪ n,ˈe ɪ ɡ ə n i,ˈb e ɪ n,ˈm e ɪ n
ˈp i k,ˈp i k,ˈh ɪ ɫ,ˈb i k,ˈe ɪ ˈp i k
ˈp e ɪ ʃ ə n s,ˈp e ɪ ʃ ə n t s,k ə m ˈp o ʊ ʒ ɝ,ˈp e ɪ ʃ ə n t,ˈp e ɪ ʃ ə n s i
ˈw ɹ æ p,ˈɹ æ p,ˈb ɫ æ ŋ k ə t,ˈm æ p,ˈb ɹ æ t
ˈɹ ɛ s t,ˈw ɹ ɛ s t,v ə ˈk e ɪ ʃ ə n,ˈb ɛ s t,ˈs ɛ s t
ˈɹ u d,ˈɹ u d,ˈb ɫ ə n t,ˈb u d,ˈk ɹ u d
ˈs e ɪ ɫ,ˈs e ɪ ɫ,ˈk ɹ u z,ˈb e ɪ ɫ,ˈa ɪ ɫ
ˈs i n,ˈs i n,ˈs ɛ t ɪ ŋ,ˈb i n,ˈs ɛ n t
ˈs i,ˈs i,ˈw ɑ t ʃ,ˈɔ i,ˈb i
ˈt ɛ n s,ˈt ɛ n t s,ˈs t ɹ e ɪ n d,ˈs ɛ n s,ˈd ɛ n s
ˈw ɔ ɹ n,ˈw ɝ n,ˈæ d v ɝ t,ˈb ɔ ɹ n,ˈɑ ɹ n
ˈw i k,ˈw i k,ˈf ɹ æ d ʒ ə ɫ,ˈb i k,ˈp i k
ˈæ k ˈs ɛ p t,ˈɛ k ˈs ɛ p t,ˈw ɛ ɫ ˌk ə m,ˈæ k ˌs ɛ p t s,ˈæ k s ə n t
ˈm ɛ ɹ i,ˈm ɛ ɹ i,ˈw ɛ d,ˈb ɛ ɹ i,ˈb æ ɹ i
ˈe ɪ s ə n t,ˈæ s ə n t,ˈk ɫ ɪ m,ˈe ɪ d ə n t,ˈæ k s ə n t
ˈɑ ˌw e ɪ,ˈɔ ˌe ɪ,ˈd ɪ s t ə n t,ˈɑ ˌw e ɪ k,ˈɔ ɫ ˌw e ɪ
ˈb æ ɹ ə n,ˈb ɑ ɹ ə n,ˈs t ɛ ɹ ə ɫ,ˈb æ k ə n,ˈb ɑ ɹ k ə n
b ɪ ˈz ɑ ɹ,ˈb æ z ɑ ɹ,ˈs t ɹ e ɪ n d ʒ,b ɪ ˈz ʊ ɹ,ˈb ɪ z ɝ ɫ i
ˈb i t,ˈb i t,ˈp a ʊ n d,ˈb ɑ t,ˈb ɛ d
ˈk æ s t,ˈk e ɪ s t,ˈt ɹ u p,ˈb æ s t,ˈa s t
ˈʃ w ɑ ɹ,ˈk w a ɪ ɝ,ˈk ɔ ɹ ə s,ˈk w ɑ ɹ,ˈt ʃ ɛ ɹ
ˈs a ɪ t,ˈs a ɪ t,ˈv ɪ ʒ ə n,ˈb a ɪ t,ˈɫ a ɪ t
ˈk ɫ o ʊ z,ˈk ɫ o ʊ ð z,ˈn ɪ ɹ,ˈk ɫ o ʊ k,ˈɫ o ʊ z
ˈk ɑ k s,ˈk ɑ k s,ˈɹ u s t ɝ z,ˈb ɑ k s,ˈk ɑ k i
ˈk a ʊ n s ə ɫ,ˈk a ʊ n s ə ɫ,ˈɫ ɔ j ɝ,ˈk ɑ n s ə ɫ,ˈk a ʊ n s ə ɫ d
ˈk ɹ i k,ˈk ɹ i k,ˈɹ ɪ v ɝ,ˈɑ ɹ i k,ˈɹ i k
ˈd ɪ ɹ,ˈd ɪ ɹ,b ɪ ˈɫ ə v d,ˈa ɪ ɹ,ˈb ɪ ɹ
ˈd u ə ɫ,ˈd u ə ɫ,ˈf a ɪ t,ˈd u ə n,ˈd u ə ɫ z
ˈf e ɪ t,ˈf i t,ˈd ɛ s t ɪ n i,ˈb e ɪ t,ˈh e ɪ t
ˈf ɛ ɹ,ˈf ɛ ɹ,ˈd ʒ ə s t,ˈb ɛ ɹ,ˈf e ɪ ɫ
ˈf ɛ ɹ i,ˈf ɛ ɹ i,ˈb o ʊ t,ˈb ɛ ɹ i,ˈb ɛ ɹ i
ˈf e ɪ z,ˈf e ɪ z,ˈb ɑ ð ɝ,ˈb e ɪ z,ˈf e ɪ d
ˈf ɪ n d,ˈf a ɪ n d,ɛ n ˈk a ʊ n t ɝ,ˈf æ n d,ˈm a ɪ n d
ˈɪ d ə ɫ,ˈa ɪ d ə ɫ,ˈh ɛ ɹ o ʊ,ˈæ d ə ɫ,ˈɪ d ɪ ɫ
ˈh w o ʊ ɫ,ˈh o ʊ ɫ,k ə m ˈp ɫ i t,ˈh w o ʊ z,ˈw ɔ ɹ ɫ
ˈn a ɪ t,ˈn a ɪ t,ˈh ɔ ɹ s m ə n,ˈb a ɪ t,ˈn a ɪ t s
ˈn o ʊ z,ˈn o ʊ z,ˈk ɑ m p ɹ ɪ ˌh ɛ n d z,ˈb o ʊ z,ˈn o ʊ
ˈɫ ɛ d,ˈɫ ɛ d,ˈɡ w a ɪ d,ˈb ɛ d,ˈɹ ɛ d
ˈɫ ɪ ŋ k s,ˈɫ ɪ ŋ k s,k ə ˈn ɛ k ʃ ə n z,ˈɫ æ ŋ k s,ˈb ɫ ɪ ŋ k s
ˈm æ n ɝ,ˈm e ɪ n ɝ,ˈd ɛ m i n ɝ,ˈb æ n ɝ,ˈb æ n d
ˈɛ ɹ,ˈh ɪ ɹ,ˈb ɹ i z,ˈɪ ɹ,ˈɑ m ɪ ɹ
ˈa ɫ a ʊ d,ˈɔ ˌɫ o ʊ d,ˈɫ a ʊ d ɫ i,ˈk ɫ a ʊ d,ˈɑ ɫ a ʊ d ɫ i
ˈa ʊ,ˈw ɑ ɹ,ˈɑ ˌm e ɪ z,ˈa d,ˈe ɪ d
ˈt ʃ æ n s,ˈt ʃ æ n t s,ˌp ɹ ɑ b ə ˈb ɪ ɫ ə t i,ˈt ʃ æ n ɝ,ˈt ʃ æ n s ə ɫ
ˈs ɪ ŋ k,ˈs ɪ ŋ k,ˈf ɔ ɫ,ˈɔ ɪ ŋ k,ˈb ɪ ŋ k
ˈk o ʊ z ə n,ˈk o ʊ ˈs i n,d ɪ ˈs i v,ˈk o ʊ d ə n,ˈk o ʊ p ə n
ˈd ɛ s ɝ t,ˈd ɛ z ɝ t,ˈs w i t,ˈd ɛ s i t,ˈd ɛ z ɝ t s
ˈd i,ˈd a ɪ,ˈp ɛ ɹ ɪ ʃ,ˈɔ i,ˈd a ɪ d
ˈh i ɫ,ˈh i ɫ,ˈɹ ɛ k ə v ɝ,ˈɔ i ɫ,ˈn i ɫ
ˈh ɪ ɹ,ˈh ɪ ɹ,ˈɫ ɪ s ə n,ˈa ɪ ɹ,ˈb ɪ ɹ
ˈp ɛ ɹ,ˈp ɪ ɹ,ˈk u p ə ɫ,ˈb ɛ ɹ,ˈf ɛ ɹ
ˈm ɔ ɹ n ɪ ŋ,ˈm ɔ ɹ n ɪ ŋ,ˈɡ ɹ i v ɪ ŋ,ˈb ɔ ɹ n ɪ ŋ,ˈm ɔ ɹ n ɪ ŋ z
ˈp i s,ˈp i s,ˈt ɹ u s,ˈs i s,ˈp i t ʃ
ˈp ɫ e ɪ n,ˈp ɫ e ɪ n,ˌj u n ə ˈd ɔ ɹ n d,ˈb ɫ e ɪ n,ˈp ɫ e ɪ n ɝ
ˈp ɔ ɹ,ˈp ʊ ɹ,ˈs ɝ v,ˈb ɔ ɹ,ˈd ɔ ɹ
ˈp ɹ e ɪ,ˈp ɹ e ɪ,ˈw ɪ ʃ,ˈɑ ɹ e ɪ,ˈb ɹ e ɪ
ˈp ɹ o ʊ f ɪ t,ˈp ɹ ɑ f ə t,ˈɝ n ɪ ŋ z,ˈp ɹ ɑ f ɪ t s,ˈp ɹ ɑ f ə t ɪ d
ˈs o ʊ ɫ,ˈs u ɫ,ɛ k ˈs k ɫ u s ɪ v,ˈh o ʊ ɫ,ˈb o ʊ ɫ
ˈs ə m,ˈs o ʊ m,ˈæ ɡ ɹ ə ˌɡ e ɪ t,ˈb ə m,ˈt ə m
ˈs t ɛ ɹ z,ˈs t ɛ ɹ z,ˈs t ɛ p s,ˈs t ɛ ɹ d,ˈs t ɛ ɹ
ˈs t i ɫ,ˈs t i ɫ,ˈm ɛ t ə ɫ,ˈs k i ɫ,ˈs t i d
ˈs w i t,ˈs w i t,ˈd ɛ s ɝ t,ˈk w i t,ˈʃ i t
ˈt e ɪ ɫ,ˈt e ɪ ɫ,ˈs t ɔ ɹ i,ˈb e ɪ ɫ,ˈe ɪ ɫ
ˈw e ɪ,ˈw e ɪ,ˈɹ u t,ˈb e ɪ,ˈɑ ˌw e ɪ
ˈɫ o ʊ d,ˈɫ o ʊ d,ˈf ɪ ɫ,ˈb o ʊ d,ˈɡ o ʊ d
ˈm ʊ ɹ,ˈm ɔ ɹ,ˈw e ɪ s t ˌɫ æ n d,ˈa ʊ ɹ,ˈb ʊ ɹ
ˈɑ d,ˈɑ d,ˈs t ɹ e ɪ n d ʒ,ˈɑ ɫ,ˈd ɑ d
ˈw ɛ t,ˈw ɛ t,ˈʃ ɑ ɹ p ə n,ˈb ɛ t,ˈw ɛ ð ɝ
ˈt o ʊ,ˈt o ʊ,ˈp ʊ ɫ,ˈt u,ˈt o ʊ
ˈv a ɪ ɫ,ˈv i ə ɫ,ˈb æ d,ˈb a ɪ ɫ,ˈe ɪ ɫ
ˈv e ɪ n,ˈv e ɪ n,ˌɛ ɡ ə ˈt ɪ s t ɪ k ə ɫ,ˈb e ɪ n,ˈp e ɪ n
ˈm e ɪ ɫ,ˈm e ɪ ɫ,ˈɫ ɛ t ɝ,ˈb e ɪ ɫ,ˈɹ e ɪ ɫ
ˈm e ɪ z,ˈm e ɪ z,ˈɫ æ b ɝ ɪ n θ,ˈb e ɪ z,ˈɑ ˌm e ɪ z
ˈf e ɪ z,ˈf e ɪ z,ˈs t e ɪ d ʒ,ˈb e ɪ z,ˈt ʃ e ɪ z
ˈp e ɪ ɫ,ˈp e ɪ ɫ,ˈb ə k ə t,ˈb e ɪ ɫ,ˈp e ɪ d
ˈɡ ɹ a ʊ n,ˈɡ ɹ o ʊ n,ˈe ɪ d ə ɫ t,ˈb ɹ a ʊ n,ˈɡ ɹ a ʊ ɫ
ˈp ɑ ɫ,ˈp o ʊ ɫ,ˈv o ʊ t,ˈb ɑ ɫ,ˈb ɑ ɫ
ˈw ɪ t,ˈw ɪ t,ˈw ɪ s d ə m,ˈa ɪ t,ˈw ɪ t s
ˈh a ɪ,ˈh i,ˈt ɔ ɫ,ˈb a ɪ,ˈh e ɪ
ˈa d,ˈæ d,a ˈn a ʊ n s m ə n t,ˈa t,ˈa
ˈæ f ɪ k t,ˈɛ f ɪ k t,ˈɔ ɫ t ɝ,ˈæ d ɪ k t,ə ˈf ɛ k t ɪ d
ˈa ɪ ɫ,ˈe ɪ ɫ,ˈb ɑ ð ɝ,ˈa ɪ ɝ,ˈe ɪ ɫ z
ˈɔ ɫ,ˈɔ ɫ,ɛ n ˈt a ɪ ɝ,ˈɑ ɫ,ˈɔ ɫ ɪ n
ˈb i,ˈb i,ˈp ɑ ɹ t i,ˈɔ i,ˈb i f
ˈb i t ʃ,ˈb i t ʃ,ˈk o ʊ s t,ˈb æ t ʃ,ˈb i t ʃ i
ˈb o ʊ,ˈb o ʊ,ˈb ɔ ɪ ˌf ɹ ɛ n d,ˈc o ʊ,ˈb ɛ d
ˈb ɪ n,ˈb i n,ˈb ɑ k s,ˈb æ n,ˈb ɪ n z
ˈb ɪ ɫ d,ˈb ɪ ɫ d,ˈæ d v ɝ ˌt a ɪ z d,ˈa ɪ ɫ d,ˈb ɔ ɫ d
ˈb ɔ ɹ,ˈb ɔ ɹ,ˈp ɪ ɡ,ˈb ɑ ɹ,ˈb ɑ ɹ
ˈb ɔ ɹ d,ˈb ɔ ɹ d,ˈp æ n ə ɫ,ˈb ɔ ɫ d,ˈe ɪ ˈb ɔ ɹ d
ˈb ɔ ɹ d ɝ,ˈb ɔ ɹ d ɝ,ˈɛ d ʒ,ˈb ɔ ɫ d ɝ,ˈb ɝ d ɝ
ˈb o ʊ ɫ d ɝ,ˈb o ʊ ɫ d ɝ,ˌæ d ˈv ɛ n t ʃ ɝ ə s,ˈb o ʊ ɫ t ɝ,ˈb o ʊ d ɝ
ˈb ɔ ɪ,ˈb ɔ ɪ,ˈɡ w i,ˈb e ɪ,ˈt ɔ ɪ
ˈb ɹ i k,ˈb ɹ e ɪ k,ˈk ɹ æ k,ˈɑ ɹ i k,ˈb i k
ˈb ɹ ɛ d,ˈb ɹ ɛ d,ˈk ə ɫ t ɪ ˌv e ɪ t ɪ d,ˈb ɹ æ d,ˈɛ ɹ d
ˈb ɹ ɪ d ə ɫ,ˈb ɹ a ɪ d ə ɫ,ɛ ˈs p u z ə ɫ,ˈb ɹ ɪ k ə ɫ,ˈb ɹ a ɪ ˌd e ɪ ɫ
ˈb ɹ o ʊ t ʃ,ˈb ɹ u t ʃ,ˈb ɹ ɪ ŋ ▁ ˈə p,ˈb ɹ i t ʃ,ˈe ɪ ˈb ɹ o ʊ t ʃ
ˈs ɛ n s,ˈs ɛ n t s,ˈf i ɫ,ˈs ɛ n t,ˈs ɛ n s
ˈs ɪ ɹ i ə ɫ,ˈs ɪ ɹ i ə ɫ,ˈw i t,ˈe ɪ ɹ i ə ɫ,ˈs ɛ ɹ ə ɫ
ˈt ʃ e ɪ s t,ˈt ʃ e ɪ s t,ˈs ɛ ɫ ə ˌb e ɪ t,ˈt ʃ e ɪ p t,ˈk e ɪ s t
ˈʃ u t,ˈʃ u t,ˈb ɫ æ s t,ˈb u t,ˈh u t
ˈs a ɪ t,ˈs a ɪ t,ˈk w o ʊ t,ˈb a ɪ t,ˈb a ɪ t
ˈk ɫ ɔ z,ˈk ɫ ɔ z,ˈɑ ɹ t ɪ k ə ɫ,ˈk ɫ ɔ ɹ,ˈk ɔ z
ˈk ɔ ɹ s,ˈk ɔ ɹ s,ˈɹ u d,ˈk ɑ ɹ s,ˈk ɔ ɹ s ɝ
ˈk ɝ n ə ɫ,ˈk ɑ ɫ ə ˌn ɛ ɫ,ˈn ə t,ˈk æ n ə ɫ,ˈk ɛ n ə ɫ
ˈk u p,ˈk u,ˈo ʊ v ɝ ˌθ ɹ o ʊ,ˈk æ p,ˈk u p s
ˈk ɔ ɹ,ˈk ɔ ɹ p s,ˈb ɑ s ɪ s,ˈb ɔ ɹ,ˈb ɔ ɹ
ˈk ɹ i k,ˈk ɹ i k,ˈs k ɹ i t ʃ,ˈɑ ɹ i k,ˈk ɹ i k s
ˈk ɹ u z,ˈk ɹ u z,ˈs e ɪ ɫ ɪ ŋ,ˈb ɹ u z,ˈb ɹ u z ɝ
ˈs ɪ m b ɔ ɫ,ˈs ɪ m b ə ɫ,ˈɛ m b ɫ ə m,ˈs ɛ m p ə ɫ,ˈs ɪ m b ə ɫ z
ˈf e ɪ n t,ˈf a ɪ n t,ˈv e ɪ ɡ,ˈf ɛ n t,ˈp e ɪ n t
ˈd e ɪ z,ˈd e ɪ z,ˈs t u p ɝ,ˈb e ɪ z,ˈd e ɪ z d
ˈd u,ˈd u,ˈe ɪ ˈt ʃ i v,ˈb u,ˈa ˈd o ʊ
d ɪ ˈs k ə s t,ˈd ɪ s ɡ ə s t,ˈæ n ə ˌɫ a ɪ z d,ˈd ɪ s k ə s,ˈd ɪ s k ə s ɝ
ˈd ə f,ˈd u,ˈb ɹ ɛ d,ˈb ə f,ˈb o ʊ
ˈd ɔ f s,ˈd o ʊ z,ˈb ɹ ɛ d z,ˈd ɔ f ɝ,ˈd ə f
ˈd ɹ æ f t,ˈd ɹ ɔ t,ˈb ɫ u ˌp ɹ ɪ n t,ˈk ɹ æ f t,ˈɹ æ f t
ˈf æ k t s,ˈf æ k s,ˈɹ i ɫ ɪ t i,ˈf æ k t i,ˈf æ k s
ˈf i t,ˈf i t,ˈt ɹ a ɪ ə m f,ˈb i t,ˈm i t
ˈf a ɪ ɫ,ˈf a ɪ ə ɫ,ˈɹ ɛ k ɝ d,ˈb a ɪ ɫ,ˈm a ɪ ɫ
ˈf ɫ ɛ ɹ,ˈf ɫ ɛ ɹ,ə ˈb ɪ ɫ ə t i,ˈb ɫ ɛ ɹ,ˈɫ ɛ ɹ
ˈf ɫ i,ˈf ɫ i,ˈd ɛ p ɑ ɹ t,ˈɔ ɫ i,ˈe ɪ ˈɫ i
ˈf ɫ u,ˈf ɫ u,ˈt ʃ ɪ m n i,ˈb ɫ u,ˈk ɫ u
ˈf ɫ ɑ k s,ˈf ɫ ɑ k s,ˈæ s ə m b ɫ i,ˈf ɫ æ k s,ˈf ɫ ɑ k
ˈf ɫ o ʊ,ˈf ɫ o ʊ,ˈa ɪ s b ɝ ɡ,ˈa ɫ o ʊ,ˈe ɪ ˈɫ o ʊ
ˈf ɫ a ʊ ɹ,ˈf ɫ a ʊ ɝ,ˈb ɫ ɑ s ə m,ˈk ɫ a ʊ ɹ,ˈf ɫ ɝ i
ˈf ɔ ɹ ˌw ɝ d,ˈf ɔ ɹ w ɝ d,ˈp ɹ i m b ə ɫ,ˈf ɔ ɹ w ɝ d ɝ,ˈf ɔ ɹ ˌw ɝ ɫ d
ˈf u ɫ,ˈf a ʊ ɫ,ˈf ɛ t ɪ d,ˈb u ɫ,ˈe ɪ f u ɫ
ˈf ɹ i z,ˈf ɹ i z,ɹ ɪ ˈf ɹ ɪ d ʒ ɝ ˌe ɪ t,ˈb ɹ i z,ˈp ɹ i z
ˈf ɹ a ɪ ɝ,ˈf ɹ a ɪ ɝ,ˈm ɑ ŋ k,ˈb ɹ a ɪ ɝ,ˈb ɹ a ɪ ɝ
ˈɡ ɪ ɫ d,ˈɡ w ɪ ɫ d,ˈe ɪ d ɝ n,ˈa ɪ ɫ d,ˈɡ ɛ ɫ d
ˈn a ɪ s,ˈɡ n i s,ˈk ɔ ɹ d i ə ɫ,ˈa ɪ s,ˈd a ɪ s
ɡ ɝ ˈɪ ɫ ə,ɡ ɔ ˈɹ ɪ ɫ ə,k ə ˈm æ n d o ʊ,p ɝ ˈɪ ɫ ə,ɡ ɝ ˈɪ ɫ ə z
ˈɡ ɹ i t,ˈɡ ɹ e ɪ t,ˈɑ m ə z ɪ ŋ,ˈɑ ɹ i t,ˈk ɹ i t
ˈɡ ɹ e ɪ z,ˈɡ ɹ e ɪ z,ˈs k ɹ e ɪ p,ˈb ɹ e ɪ z,ˈb ɹ e ɪ z
ˈɡ ɹ ɪ s ɫ i,ˈɡ ɹ ɪ z ɫ i,ˈh ɔ ɹ ə b ə ɫ,ˈɡ ɹ ɪ m ɫ i,ˈɡ ɹ ɪ s t ɫ i
ˈɡ ɹ o ʊ n,ˈɡ ɹ a ʊ n,ˈɡ ɹ ə n t,ˈk ɹ o ʊ n,ˈɡ ɹ o ʊ n z
ˈɡ ɛ s t,ˈɡ ɛ s t,ˈɛ s t ə ˌm e ɪ t ɪ d,ˈb ɛ s t,ˈɡ ɛ s ɝ
ˈh ɛ ɹ i,ˈh æ ɹ i,ˈf ɝ i,ˈb ɛ ɹ i,ˈd ɛ ɹ i
ˈh ɔ ɫ,ˈh o ʊ ɫ,ˈɛ n t ɹ ə n s,ˈb ɔ ɫ,ˈɔ ɫ
ˈh e ɪ v,ˈh æ ɫ v,ˈɑ ˈk w a ɪ ɝ,ˈk e ɪ v,ˈɹ e ɪ v
ˈh ɝ t,ˈh ɑ ɹ t,ˈɫ ə v,ˈb ɝ t,ˈh ɪ ɹ
ˈh ɪ ɹ d,ˈh ɝ d,ˈɫ ɪ s ə n d,ˈb ɪ ɹ d,ˈh ɝ t
ˈh ɛ ɹ ɔ ɪ n,ˈh ɛ ɹ ɔ ɪ n,ˈt ʃ æ m p i ə n,ˈh ɛ ɹ p ɪ n,ˈh ɛ ɹ w ɑ z
ˈh a ɪ ɹ,ˈh a ɪ ɝ,ˈɛ m ˌp ɫ ɔ ɪ,ˈb a ɪ ɹ,ˈɛ ɹ
ˈh ɔ ɹ d,ˈh ɔ ɹ d,ˌæ k j ə m j ə ˈɫ e ɪ ʃ ə n,ˈb ɔ ɹ d,ˈh ɔ ɹ d z
ˈh ɔ ɹ s,ˈh ɔ ɹ s,ˈh ɑ ɹ ʃ,ˈk ɔ ɹ s,ˈh ɔ ɹ s ɝ
ˈh o ʊ ɫ d,ˈh o ʊ ɫ d,ˈɡ ɹ ɪ p,ˈb o ʊ ɫ d,ˈm o ʊ ɫ d
ˈh o ʊ ɫ i,ˈh o ʊ ɫ i,d ɪ ˈv a ɪ n,ˈb o ʊ ɫ i,ˈk o ʊ ɫ i
ˈɪ n,ˈɪ n,ˈh ɑ s t ə ɫ,ˈa n,ˈæ n
ˈɪ n ˌs a ɪ t,ˈɪ n ˌs a ɪ t,ˈæ d ʒ ə ˌt e ɪ t,ˈɪ n ˌs a ɪ d,ˈɪ n ˈs a ɪ d
ˈd ʒ u ə ɫ,ˈd ʒ u ɫ,ˈɡ ɛ m,ˈd ʒ u ə ɫ z,ˈɫ ɛ v ə ɫ
ˈn i d,ˈn i d,ˈk ɑ m ə t m ə n t,ˈs i d,ˈd i d
ˈk n ɪ t,ˈn ɪ t,ˈs j u,ˈk e ɪ t,ˈn ɛ t
ˈɫ i k,ˈɫ i k,ˈk ɹ æ k,ˈb i k,ˈe ɪ ɫ i k
ˈɫ i n,ˈɫ i n,ˈɪ ŋ ˈk ɫ a ɪ n,ˈb i n,ˈd i n
ˈɫ ɛ s ə n,ˈɫ ɛ s ə n,ˈp ɹ æ k t ɪ s,ˈɫ ɪ s ə n,ˈɫ i ʒ ə n
ˈɫ a ɪ ə b ə ɫ,ˈɫ ɪ b ə ɫ,ə ˈk a ʊ n t ə b ə ɫ,ˈb a ɪ ə b ə ɫ,ˈɫ a ɪ k ə b ə ɫ
ˈɫ a ɪ ɝ,ˈɫ a ɪ ɹ,ˈt ʃ i t,ˈb a ɪ ɝ,ˈf i ɑ ɹ
ˈɫ i,ˈɫ a ɪ,ˈd ɛ s i t,ˈɔ i,ˈd i
ˈɫ o ʊ n,ˈɫ o ʊ n,ˈk ɹ ɛ d ɪ t,ˈb o ʊ n,ˈm o ʊ n
ˈm e ɪ d,ˈm e ɪ d,ˈs ɝ v ə n t,ˈb e ɪ d,ˈk e ɪ d
ˈm ɔ ɫ,ˈm ɔ ɫ,ˈm ɑ ɹ k ɪ t ˌp ɫ e ɪ s,ˈb ɔ ɫ,ˈɔ ɫ
ˈm ɑ ɹ ʃ ə ɫ,ˈm ɑ ɹ ʃ ə ɫ,ˈm ɪ ɫ ə ˌt ɛ ɹ i,ˈm ɑ ɹ ʃ ə n,ˈp ɑ ɹ ʃ ə ɫ
ˈm æ s t,ˈm æ s t,ˈp o ʊ ɫ,ˈb æ s t,ˈa s t
ˈm ɪ s t,ˈm ɪ s t,ˈɫ ɑ s t,ˈm ɪ k s t,ˈm ɪ s ə ɫ d
ˈm o ʊ n,ˈm a ʊ n,ˈw a ɪ n,ˈb o ʊ n,ˈɫ o ʊ n
ˈm o ʊ d,ˈm o ʊ d,ˈs t a ɪ ɫ,ˈb o ʊ d,ˈb o ʊ d
ˈm u d,ˈm u d,ˈf i ɫ ɪ ŋ,ˈb u d,ˈm u k
ˈm u s,ˈm u s,ˈd ɪ ɹ,ˈb u s,ˈb u s
ˈw ɑ n,ˈw ə n,ˈe ɪ ˈt ʃ i v d,ˈb ɑ n,ˈɔ n
ˈp ɔ z,ˈp ɔ z,ˈs t ɑ p,ˈk ɔ z,ˈp ɔ z ɪ z
ˈp ɪ ɹ,ˈp i ɝ,ə ˈs o ʊ ʃ i ˌe ɪ t,ˈa ɪ ɹ,ˈb ɪ ɹ
ˈp i,ˈp i,ˈk e ɪ k,ˈɔ i,ˈd i
ˈp ɪ s t ə ɫ,ˈp ɪ s t ə ɫ,ˈf a ɪ ɹ ɑ ɹ m,ˈe ɪ s t ə ɫ,ˈp ɪ s t ə ɫ z
ˈp ɫ i z,ˈp ɫ i z,ə ˈp i ɫ z,ˈɔ ɫ i z,ˈp ɫ i
ˈp ʊ ɹ,ˈp ɔ ɹ,ˈɪ n d ɪ d ʒ ə n t,ˈa ʊ ɹ,ˈb ʊ ɹ
ˈp ɹ e ɪ z,ˈp ɹ e ɪ z,ˈæ ˌk ɫ e ɪ m,ˈb ɹ e ɪ z,ˈɹ e ɪ z
ˈp ɹ i z ə n t s,ˈp ɹ i z ə n s,ˈɡ ɪ f t s,ˈp ɹ i z ə n t,p ɹ ɪ ˈz ɛ n t ɪ d
ˈp ɹ a ɪ d,ˈp ɹ a ɪ d,ˈd ɪ ɡ n ɪ t i,ˈɹ a ɪ d,ˈb ɹ a ɪ d
ˈp ɹ ɪ n s ə p ə ɫ,ˈp ɹ ɪ n s ə p ə ɫ,ˈm e ɪ n,ˈp ɹ ɪ n s ə p ə ɫ z,ˈp ɹ ɪ n s ə p ɫ i
ˈɹ æ k ə t,ˈɹ æ k ə t,ɛ k ˈs t ɔ ɹ ʃ ə n,ˈb ə k ə t,ˈɹ æ k ə t s
ˈɹ e ɪ n,ˈɹ e ɪ n,p ɹ ɪ ˌs ɪ p ə ˈt e ɪ ʃ ə n,ˈb e ɪ n,ˈa ɹ e ɪ n
ˈɹ e ɪ n,ˈɹ e ɪ n,ˈd a ɪ n ə s t i,ˈb e ɪ n,ˈd e ɪ n
ˈɹ e ɪ z,ˈɹ e ɪ z,ˈb u s t,ˈb e ɪ z,ˈb ɹ e ɪ z
ˈɹ i k,ˈw ɹ i k,ˈf e ɪ t ɝ,ˈb i k,ˈɑ ɹ i k
ˈw ɹ ɛ t ʃ,ˈɹ ɛ t ʃ,ˈɹ æ s k ə ɫ,ˈk ɹ ɛ t ʃ,ˈɛ t ʃ
ˈɹ ɛ v ˌj u,ˈɹ ɛ v ˌj u,ˈæ n ə ˌɫ ɪ s ɪ s,ˈb ɛ v ˌj u,ˈp ɹ ɛ v ˌj u
ˈɹ a ɪ m,ˈɹ a ɪ m,ˈf ɹ ɔ s t,ˈk a ɪ m,ˈk ɹ a ɪ m
ˈɹ a ɪ t,ˈɹ a ɪ t,ˈk ɔ ɹ ɛ k t,ˈb a ɪ t,ˈɑ ɹ a ɪ t
ˈɹ o ʊ d,ˈɹ o ʊ d,ˈa v ə n ˌj u,ˈb o ʊ d,ˈb ɹ o ʊ d
ˈʐ o ʊ m,ˈɹ o ʊ m,ˈɹ æ m b ə ɫ,ˈk o ʊ m,ˈf o ʊ m
ˈɹ o ʊ ɫ,ˈɹ o ʊ ɫ,ˈæ k t,ˈp o ʊ ɫ,ˈb o ʊ ɫ
ˈɹ u t,ˈɹ u t,ˈf a ʊ n ˈd e ɪ ʃ ə n,ˈb u t,ˈh u t
ˈɹ o ʊ,ˈɹ ə f,ˌɪ ˈɹ ɛ ɡ j ə ɫ ɝ,ˈb o ʊ,ˈb o ʊ
ˈɹ a ʊ t,ˈɹ u t,ˈʃ u ˌt a ʊ t,ˈb a ʊ t,ˈa ʊ t
ˈʐ u,ˈɹ u,ˈɹ ɛ ɡ ɹ ə t,ˈb u,ˈk j u
ˈɹ a ɪ,ˈw ɹ i,ˈɡ ɹ e ɪ n,ˈb a ɪ,ˈa ɪ
ˈs æ k s,ˈs æ k s,ˈf a ɪ ɝ z,ˈf æ k s,ˈh æ k s
ˈs i m,ˈs i m,ˈd ʒ ɔ ɪ n t,ˈb i m,ˈt i m
ˈs ɪ ɹ,ˈs ɪ ɹ,ˈt o ʊ s t,ˈa ɪ ɹ,ˈn ɪ ɹ
ˈs a ɪ z,ˈs i z,ˈk æ t ʃ,ˈc a ɪ z,ˈs a ɪ n
ˈs ɝ d ʒ,ˈs ɝ d ʒ,ˈɪ ŋ ˈk ɹ i s,ˈd ɝ d ʒ,ˈɝ d ʒ
ˈs ɪ k,ˈs ɪ k,ˈɪ ɫ,ˈe ɪ k,ˈɪ k
ˈs a ɪ z,ˈs a ɪ z,d ɪ ˈm ɛ n ʃ ə n z,ˈc a ɪ z,ˈs a ɪ d
ˈs a ɪ n,ˈs a ɪ n,ˌm æ n ə f ə ˈs t e ɪ ʃ ə n,ˈb a ɪ n,ˈs a ɪ
ˈs ɫ e ɪ,ˈs ɫ e ɪ,ə ˈs æ s ə ˌn e ɪ t,ˈp ɫ e ɪ,ˈɫ e ɪ
ˈs ɫ o ʊ,ˈs ɫ o ʊ,ˈɫ ɛ θ ɑ ɹ d ʒ ɪ k,ˈa ɫ o ʊ,ˈb ɫ o ʊ
ˈs w ɑ ɹ,ˈs ɔ ɹ,ˈa s ə n d,ˈʃ w ɑ ɹ,ˈw ɑ ɹ
ˈs ɔ ɹ d,ˈs w ɝ d,ˈɛ s k ə ˌɫ e ɪ t ɪ d,ˈb ɔ ɹ d,ˈw ɔ ɹ d
ˈs ɑ n,ˈs ə n,ˈb ɔ ɪ,ˈb ɑ n,ˈɔ n
ˈs ə n i,ˈs ɑ n i,ˈɫ u m ə n ə s,ˈb ə n i,ˈf ə n i
ˈs t e ɪ k,ˈs t i k,ˈp o ʊ ɫ,ˈs ɫ e ɪ k,ˈs e ɪ k
ˈs t e ɪ ʃ ə ˌn ɛ ɹ i,ˈs t e ɪ ʃ ə n ɝ i,ˈf ɪ k s t,ˌs t e ɪ ʃ ə ˈn ɛ ɹ ə t i,ˈs t e ɪ ʃ ə n ɝ
ˈs t ɹ e ɪ t,ˈs t ɹ e ɪ t,ˈh o ʊ n ə s t,ˈs t ɹ e ɪ d,ˈs t ɹ e ɪ n
ˈs ə m ɝ i,ˈs ə m ɝ i,ˈɛ s ə n s,ˈm ə m ɝ i,ˈn ə m ɝ i
ˈt æ k s,ˈt æ k s,ˌk ɑ n t ɹ ə b ˈj u ʃ ə n,ˈf æ k s,ˈɹ æ k s
ˈt ɪ ɹ,ˈt ɛ ɹ,ˈh o ʊ ɫ,ˈa ɪ ɹ,ˈd ɪ ɹ
ˈt ɔ t,ˈt ɔ t,ˈt a ɪ t,ˈb ɔ t,ˈt æ t
ˈt i m,ˈt i m,ˈk ɹ u,ˈb i m,ˈɹ i m
ˈt i z,ˈt i z,ˈp ɹ ɑ ˌv o ʊ k,ˈb i z,ˈi s
ˈt a ɪ t ə n,ˈt a ɪ t ə n,ˈn ɛ ɹ o ʊ,ˈt ʃ ɪ t ə n,ˈɫ a ɪ t ə n
ˈt o ʊ ɫ d,ˈt o ʊ ɫ d,ˈs e ɪ d,ˈb o ʊ ɫ d,ˈo ʊ ɫ d
ˈt u n,ˈt u n,ˈm ɛ ɫ ə d i,ˈb u n,ˈe ɪ ˈt u n
ˈt ɹ æ k t,ˈt ɹ æ k t,ˈt ɹ e ɪ ɫ d,ˈb ɹ æ k t,ˈk ɹ æ k t
ˈt ɹ u p,ˈt ɹ u p,ˈɑ ɹ m i,ˈt ʃ u p,ˈd ɹ u p
ˈt ɹ ə s t,ˈt ɹ ə s t,ˈk ɑ n f ə d ə n s,ˈɑ ɹ ə s t,ˈk ɹ ə s t
ˈj u z,ˈj u z,ˈj u t ə ˌɫ a ɪ z,ˈb u z,ˈm j u z
ˈv ɛ ɹ i,ˈv ɛ ɹ i,ˈt ʃ e ɪ n d ʒ,ˈb ɛ ɹ i,ˈm ɛ ɹ i
ˈv ɝ s ɪ z,ˈv ɝ s ə s,ˈp o ʊ m z,ˈv ɝ s,ˈɝ s
ˈw a ɪ n,ˈw a ɪ n,ˈa ɫ k ə ˌh ɔ ɫ,ˈb a ɪ n,ˈɫ a ɪ n
